Company,Tag
SOUTHERN ORGANO PRODUCTS PRIVATE LIMITED,1
MADURAI MARINE CHEMICALS PRIVATE LIMITED,1
CALCIUM (INDIA) PVT LTD,1
BOMBAY AMMONIA (MADRAS) PRIVATE LIMITED,1
HONESTY EXPORTS & IMPORTS PRIVATE LIMITED,1
SRIRAM CHEMICAL WORKS PRIVATE LIMITED,1
SHIV KUMAR AND CO PRIVATE LIMITED,1
VEDHA CHEMICALS PRIVATE LIMITED,1
BALAJI SOLVENTS PRIVATE LIMITED,1
CHEMMIX PRIVATE LIMITED,1
SAI CHEM DYES PRIVATE LIMITED,1
SOUTHERN ALGINATE LTD,1
MOHAN ALKALINE CHEMICALS PRIVATE LIMITED,1
UNITED CALCARB PVT LTD,1
SREE LAKSHMI NARAYANA CHEMICALS PRIVATE LIMITED,1
SREE PADMAVATHI CHEMICALS PRIVATE LIMITED,1
SOUTHERN INORGANICS PRIVATE LIMITED,1
LUBALL PRODUCTS & AGENCIES PRIVATE LIMITED,1
BHAGAWATHI CHEMICALS INDUSTRIES PVT.LTD.,1
GAJAPATHY SALT CO PVT LTD,1
SILICON (INDIA) PRIVATE LIMITED,1
JAKHAU SALT COMPANY PRIVATE LIMITED,1
SRI SAKTHI OXIGEN LIMITED,1
SEASHORE ESTATES & PROPERTIES LIMITED,1
AMALGAMATED AGRO SYSTEMS PVT LTD.,1
CHELLAS AGRO PRODUCTS PRIVATE LIMITED,1
CHESMA CHEMICALS PRIVATE LIMITED,1
SIVA PECTIN PRIVATE LIMITED,1
KOR CHEMICALS PRIVATE LIMITED,1
DYETEX (INDIA) PRIVATE LIMITED,1
CHEMGUARD COATINGS PRIVATE LIMITED,1
CHEMBOND DREWTREAT LIMITED,1
VIJAYA PESTICIDES (MADRAS) PRIVATE LIMIT ED,1
KALYAN OXYGEN PRIVATE LIMITED,1
MANYA BIO LABORATORIES PRIVATE LIMITED,1
TRISTAR CHEMICALS PRIVATE LIMITED,1
ASIAN PEROXIDES LIMITED,1
TUTICORIN IODISED SALT INDUSTRIES PRIVATE LIMITED,1
JAIJICHEM INDUSTRIAL PRODUCERS PRIVATE LIMITED,1
ASIAN PEROXIDES PRIVATE LIMITED,1
PUSHYA INDUSTRIAL GASES LIMITED,1
GANDHI CERAMICS PRIVATE LIMITED,1
CHEMICAL SPECIALITIES (INDIA) PRIVATE LIMITED,1
PEARL CHLORATES PRIVATE LIMITED,1
SENKA CARBON PRIVATE LIMITED,1
GODWIN CHEMICAL LTD.,1
SATYA CASHEW CHEMICALS PRIVATE LIMITED,1
SARATHY ORGANICS PVT LTD,1
VISHAKA CHEMCO PVT LTD,1
ENRICHED CHEMICALS AND REFINERY PVT LTD,1
ANAND POLYCHEM PVT LTD,1
MASRI INDUSTRIAL CHEMICALS PRIVATE LIMITED,1
SRI ADITYA POLYFILMS PRIVATE LIMITED,1
YUGA TEXTILES PVT LTD,1
YOGAMBIGAI PULVERISERS & CHEMICALS PVT L TD,1
ANDAVAR CHEMICALS PRIVATE LIMITED,1
ABIRAMI INDUSTRIAL SOLVENT PRIVATE LIMITED,1
INTAN CHEMS PVT LTD,1
LOTUS DYECHEM (INDIA) PRIVATE LIMITED,1
OVERSEAS DYES AND CHEMICALS PVT LTD,1
ATHIAPPA INORGANIC CHEMICAL WORKS PRIVATE LIMITED,1
KALPAK CHEMICALS PVT LTD,1
VAIGAI SANITATION PRIVATE LIMITED,1
BETZ INDIA PVT LTD,1
MOHAMMED RAHAMATHULLAH BARITES PRIVATE LIMITED,1
SRIVIDYATIRTHA CHEMICALS PVT LTD,1
HITECH ADDITIVES (MADRAS) PVT LTD.,1
R.G.S.V. CHEMICALS PRIVATE LIMITED,1
SAGAR CHLORATES PRIVATE LIMITED,1
CHEMICALS CATALYSTS ( INDIA ) PVT LTD,1
RAMCHEM PRIVATE LIMITED.,1
SRIDEVI EXPORTS PVT LTD.,1
ENDOTHERM FLUIDS (INDIA) PRIVATE LIMITED,1
KRITHIKA AGRO FARM CHEMICALS AND ENGINEERING INDUSTRIES PRIVATE LIMITED,1
ORGALINES PVT LTD.,1
SHRI MINAKSHI SULPHUR INDUSTRIES PRIVATE  LIMITED,1
MALLADI SPECIALITIES LIMITED,1
SANMAR PERFORMANCE CHEMICALS AND RESEARC H SERVICES LIMITED,1
NAGAS INDUSTRIAL SOLVENT PVT LTD,1
BASIC PLASTICIZERS PVT LTD,1
REDHEX CORROSION CONTROL PVT LTD.,1
RAFFES CHEMICALS PVT LTD.,1
MONOCHEM DETERGENT PVT LTD.,1
KAYAR CHEMICALS PRIVATE LIMITED,1
STERILE PRODUCTS PVT LTD,1
POPULAR DYES AND CHEMICALS PRIVATE LIMITED,1
PLANT AIDS PVT LTD,1
SUGISA AGRO CHEMICALS PVT LTD,1
HYDRO SYSTEMS PRIVATE LIMITED,1
BAHOLA LABORATORIES PRIVATE LIMITED,1
WAX THERMOSTATS PRIVATE LIMITED,1
POTHIHAI CHEMICALS PRIVATE LIMITED,1
NAITHARVA TRADING COMPANY PRIVATE LIMITED,1
VIGNESH CHEMICALS PVT LTD.,1
SOUTHERN FLAVOURSAND COLOURS PRIVATE LIMITED,1
SAKTHI ACETATE AND CHEMICALS PVT LTD.,1
VIKRISHA INDUSTRIAL SPECIALITIES PVT LTD .,1
SENTHIL FLAVOURS PVT LTD.,1
KOBE CHEMICALS PVT. LTD.,1
SOUTH INDIA BROMINE AND ALLIED CHEMICALS  PRIVATE LIMITED,1
CHEMPRO OXALATES PVT. LTD.,1
OXALIC ACID & ALLIED CHEMICALS PVT. LTD.,1
KALAR CHEMICALS (MADRAS) PRIVATE LIMITED,1
AGRO CARBONIC GASES PRIVATE LIMITED,1
RUBY CHLORATES PRIVATE LIMITED,1
BAIRAVI CHEMICAL WORKS PVT. LTD.,1
CALCUM SERVICE P. LTD.,1
DELTA PHOTOCHEM PVT. LTD.,1
SAPTHAGIRI CHEMICALS PVT. LTD.,1
MADURA DISTRIBUTERS PVT. LTD.,1
FUTURA CHEMICALS PVT. LTD.,1
SRI CHAKRA CHEMICALS PVT. LTD.,1
ANKITA TRADERS & INVESTMENTS PRIVATE LIMITED.,1
SUN CHLORATES PVT. LTD.,1
FRONTLINE DRUGS AND CHEMICALS PRIVATE LIMITED,1
AUROSHIKA CHEMICALS PVT LTD,1
TEEJAY VEE CHEMICALS PRIVATE LIMITED,1
VANSUN INTERMEDIATES PRIVATE LIMITED,1
INDO DOHA CHEMICALS AND PHARMACEUTICALS LIMITED,1
THIRUMAGAL CHEMICAL PRODUCTS LTD.,1
STERLING NITRO CHEMICAL LTD,1
REGENCY RARE MINERALS AND CHEMICALS LIMI TED,1
INTECH CHEMICALS LIMITED.,1
KAUSIK CHEMICALS LIMITED,1
IMAPRO FORMULATIONS PRIVATE LIMITED,1
SHAROFF FORGINGS PRIVATE LIMITED,1
SHREYES MICNUTRIENTS AND CHEMICALS PVT L TD,1
JANANI CHEM PRIVATE LIMITED,1
AGRO SUPER NEUTRIENTS PRIVATE LIMITED,1
SUPREME CUIR-CHEM INDIA PRIVATE LIMITED,1
TAGMA CHEMICALS PVT LTD,1
JAI BHUVANESWARI FINE CHEMICALS PVT LTD,1
KROMATIKS AND INSULANTS PRIVATE LIMITED,1
FIXATIVE AND FRAGRANCES PVT LTD,1
RANGANS HI-TECH CHEMICAL PRODUCTS PVT LT D,1
DIGVIJAY AGRO CHEMICALS PRIVATE LIMITED,1
MIKO-FINO CHEMICALS PVT. LTD.,1
SRI RAMALAKSHMI CHEMICALS PRIVATE LIMITED,1
CURRENT ORGANICS PVT. LTD.,1
ALPHA GYPSUM AND FINE CHEMICALS PRIVATE LIMITED.,1
CHEMICO DYES (INDIA) PRIVATE LIMITED,1
SHAZIA CHEMICALS PVT. LTD.,1
S K N INDCOM (MADRAS) ENTERPRISES PRIVATE LIMITED,1
VIJAYA ALUMISULPHATE INDIA PVT.LTD.,1
KRISHNA INDCEHM PRIVATE LIMITED,1
AXON DRUGS PRIVATE LIMITED,1
ARUPPUKOTTAI MARI CHEMICALS PRIVATE LIMITED.,1
S R C CHLORIDES PRIVATE LIMITED,1
YELLOW CHEMICALS PRIVATE LIMITED,1
HMN CHEMTREAT PRIVATE LIMITED,1
AMULYA ORGANICS PVT.LTD.,1
BAPROH CHEMICALS PVT.LTD.,1
VESTAL CHEMICALS PVT.LTD.,1
UNIPRO MULTITECH PRIVATE LIMITED,1
JAGGANMOHAN CHEMICALS PRIVATE LIMITED,1
PANAPHOS CHEMICALS PVT.LTD.,1
COASTAL SILICATE PRIVATE LIMITED,1
KUMEER CONSULTANTS PVT.LTD.,1
NUBIOLA INDIA PRIVATE LIMITED,1
ARROW CHEMI-FABS PVT.LTD.,1
NOVO THERMOSET PRIVATE LIMITED,1
SANGAM SYNDET AND CHEMICALS P LTD.,1
KARTHIK CHEMICAL INDUSTRIES PRIVATE LIMITED,1
TAMILNADU GURUSAI CHEMICAL INDUSTRIES LT D.,1
HORIZONS CHEMICALS PRIVATE LIMITED,1
SRI VASAVI RESINS PRIVATE LIMITED,1
VENSBAR ORGANICS PVT. LTD.,1
REACHEM LABORATORY CHEMICALS PRIVATE LIMITED,1
LABORATORY & INDUSTRIAL CHEMICALS (INDIA) PRIVATE LIMITED,1
OMNITEC LABORATORIES PRIVATE LIMITED,1
PONMANY CHEMICALS PRIVATE LIMITED,1
KANNVAREES CHEMICAL LIMITED,1
CENTURY FRUIT COMPANY LIMITED,1
AAQUA CHEMICALS AND SYSTEMS MANUFACTURING LIMITED,1
BALAJI BIOMIN LTD,1
ESA CHEMICALS PRIVATE LIMITED,1
GEMS GARDEN PRIVATE LIMITED,1
QUIN CHEM PRIVATE LTD,1
RISHAB INTERMEDIATES PRIVATE LIMITED,1
NEBULAE HEALTH CARE LIMITED,1
KILBURN POLYMERS LIMITED,1
GEM GLOBAL TRADE LIMITED,1
ETHLAN CHEMICALS PVT. LTD,1
R.K.BRIGHT STEEL INDIA PVT. LTD,1
CHLORIDE COMBINE PRIVATE LIMITED,1
NEWTON ENTERPRISES PRIVATE LIMITED,1
SHAKTHI SILICATES PRIVATE LIMITED,1
PUROSIL CHEMICALS PRIVATE LIMITED,1
CANE-TECH CHEMICALS PRIVATE LIMITED,1
A.T. ADITYAN METALS PRIVATE LIMITED,1
MCADAMS ORGANICS PRIVATE LIMITED,1
DAKSHINA SYNTHETIC BONDS AND CHEMICALS L IMITED,1
PHENOPLAST MADRAS PRIVATE LIMITED,1
ADHAVAN CHEMICALS PRIVATE LIMITED,1
VENUS PHARMA PRIVATE LIMITED,1
SDS RAMCIDES CROPSCIENCE PRIVATE LIMITED,1
SURANA IRON & STEELS LIMITED,1
CANON STEELS AND METALS LIMITED,1
PRANAM CHEMICALS PRIVATE LIMITED,1
GAJ POLYCHEMS PRIVATE LIMITED,1
WINDIA CHEMICALS PRIVATE LIMITED,1
ESVIN BIOSYS INTERNATIONAL LIMITED,1
MADUJAN CHEMICALS LIMITED,1
MICRO POLY INDUSTRIAL PRODUCTS P LTD,1
NAVOCHEM INDIA PRIVATE LIMITED,1
BAY-CHEM FABRIKS PRIVATE LIMITED,1
ELLAR PLASTOCHEM PRIVATE LIMITED,1
POLYMORPHIC SYSTEMS PRIVATE LIMITED,1
PPS CHEMICALS PRIVATE LIMITED,1
VAISHNAVI PULP & BOARDS PRIVATE LIMITED,1
A T LEATHER & CHEMICALS PRIVATE LIMITED,1
JOTHI CHEMICALS PRIVATE LIMITED,1
PICO WATERCHEM PRIVATE LIMITED,1
SHRI SWASAN CHEMICALS (MADRAS) PRIVATE LIMITED,1
BAYER SPECIALITY PRODUCTS PRIVATE LIMITE D,1
SUBA ORGANICS PRIVATE LIMITED,1
VITAL CARE PRIVATE LIMITED,1
SHINE CHEMICALS PRIVATE LIMITED,1
PROALGEN BIOTECH LIMITED,1
EVERGREEN ORGANICS LIMITED,1
REJOICE PRODUCTS LIMITED,1
AVT AGROCHEM LIMITED,1
INEXO CAST METAL SOLUTIONS PRIVATE LIMITED,1
VIJAY CONSTRO CHEMICALS PRIVATE LIMITED,1
CASO TRADING INDIA PRIVATE LIMITED,1
PKM CHEM (INDIA) PRIVATE LIMITED,1
VADALUR CHEMICAL EQUIPMENTS & LININGS PRIVATE LIMITED,1
SREE GANESH ASPHALT PRIVATE LIMITED,1
STRATEGIC ENGINEERING PRIVATE LIMITED,1
EMMES MANURE MILLS PRIVATE LIMITED,1
VELAAYUTHARAJHA CEMENT CHEMICAL PRIVATE LIMITED,1
EBENEZER CALCIUM PRIVATE LIMITED,1
JRT FINE FRAGRANCE PRIVATE LIMITED,1
SRI MAHA LAKSHMI CHEMICALS PRIVATE LIMIT ED,1
ANCO INDIA CHEMICALS PRIVATE LIMITED,1
SYNGENTA BIOSCIENCES PRIVATE LIMITED,1
ROHINI CHEM IMPEX PRIVATE LIMITED,1
PUGAZH CHEMICAL PLANT AND EQUIPMENTS PRIVATE LIMITED,1
S.DEVICHAND & COMPANY (CHEMICALS) PRIVATE LIMITED,1
ASHTALAKSHMI PAPER PRODUCT PRIVATE LIMITED,1
CHENNAI ALUM CHEMICAL PRIVATE LIMITED,1
RCS CHEMICALS PRIVATE LIMITED,1
PEARL SILICON PRODUCTS PRIVATE LIMITED,1
MAGNUM OILS & CHEMICALS PRIVATE LIMITED,1
VENTURES DETERGENTS & SOAPS PRIVATE LIMI TED,1
ELLAK CHEM INDUSTRIES (INDIA) PRIVATE LIMITED,1
MICRO SULPHUR PRIVATE LIMITED,1
KRUPA COLOURS PRIVATE LIMITED,1
TAPAVAS CHEMI LIMITED,1
STAHL INDIA PRIVATE LIMITED,1
MAHAVEER SURFACTANTS PRIVATE LIMITED,1
INTERPORT (ASIATIC) COMPANY PRIVATE LIMITED,1
JAS OVERSEAS EXPORTS PRIVATE LIMITED,1
CHITRAA MIN-KEM PRIVATE LIMITED,1
DECCAN REFINETECH PRIVATE LIMITED,1
MIL TRADING PRIVATE LIMITED,1
JOPPA MARKETING PRIVATE LIMITED,1
LANGRO CHEMIE INDIA PRIVATE LIMITED,1
AISHWARYAA ORGANICS PRIVATE LIMITED,1
B-PURA LABORATORIES PRIVATE LIMITED,1
PRODORITE ANTICORROSIVES LIMITED,1
CHEMISE INDUS PRIVATE LIMITED,1
VEMASSHI CHEMICALS PRIVATE LIMITED,1
GOWRI LAKSHMI SPECIALITY CHEMICALS PRIVATE LIMITED,1
SINGHUI MERCHANDISE PRIVATE LIMITED,1
ISWAR CHEMICALS AND ACCELERATORS PRIVATE  LIMITED,1
VISHANTI CHEMICALS PRIVATE LIMITED,1
SAN-SA-CHEMICALS PRIVATE LIMITED,1
LORDRICH CHEMICALS LIMITED,1
V.L.S. PULP & CHEMICALS PRIVATE LIMITED,1
SREE GNANAKSHI CHEMICALS PRIVATE LIMITED,1
CHATHURA CHEMICALS PRIVATE LIMITED,1
MSN CHEM INTERNATIONAL PRIVATE LIMITED,1
NATSHO ENTERPRISES PRIVATE LIMITED,1
WASSER CHEMICALS & SYSTEMS PRIVATE LIMITED,1
ARANTHANGI CHEMICALS (UNIT-II) PRIVATE L IMITED,1
SALVARE CHEMIE INDIA PRIVATE LIMITED,1
ARA A-RANK CORPORATION (INDIA) PRIVATE LIMITED,1
DCW PIGMENTS LIMITED,1
ANEKAR SALTS PRIVATE LIMITED,1
VEERA CHEMICALS (INDIA) PRIVATE LIMITED,1
BRAHMAR CELLULOSE PRODUCTS PRIVATE LIMITED,1
BHAVISHYA ENERGY PRIVATE LIMITED,1
SHIELDS CHEMICALS PRIVATE LIMITED,1
ARBIN CHEM PRIVATE LIMITED,1
SAFETY KEMICALS INDIA PRIVATE LIMITED,1
ALAGAR SALTS PRIVATE LIMITED,1
GURUDEV CHEMICALS PRIVATE LIMITED,1
BALSARA BIOSCIENCES PRIVATE LIMITED,1
OSIYAN OXYGEN PRIVATE LIMITED,1
INDUS CHEMIE EXPORTS PRIVATE LIMITED,1
MEDSHELL LIFE SCIENCES INDIA PRIVATE LIMITED,1
KULIGAI CHEMICALS AND PHARMACEUTICALS PRIVATE LIMITED,1
ERG BIO CARE PRIVATE LIMITED,1
DUKES FORMULATIONS PRIVATE LIMITED,1
K.C.P. BIO-TECH LIMITED,1
SAYAPUTIRAR CHEM PRIVATE LIMITED,1
MANASAROVER BOOMI AGRO FUELS PRIVATE LIM ITED,1
EAST COAST ORGANIIC EXIIMS PRIVATE LIMITED,1
CAVIN PLASTICS AND CHEMICALS PRIVATE LIM ITED,1
SOUTHERN AGRIFURANE INDUSTRIES PRIVATE LIMITED,1
CHEMASIA INDUSTRIES LIMITED,1
SANMAR GROUP INTERNATIONAL LIMITED,1
CHEMASIA INDUSTRIES PRIVATE LIMITED,1
OREN MUD CHEMICALS PULVERISING PRIVATE LIMITED,1
PONDICHERRY ORGANICS PRIVATE LIMITED,1
SRI MULTI MAG PRIVATE LIMITED,1
LIFESCIENCE LABORATORIES PRIVATE LIMITED,1
CETEX PETROCHEMICALS LIMITED,1
GEE GEE KAY PRIVATE LIMITED,1
SWAMI & CO PRIVATE LIMITED,1
TCT AQUA CHEMICALS PRIVATE LIMITED,1
J.R.D. ORGANIC AND CHEMICALS PRIVATE LIMITED,1
TITANIUM NICKLE WORKS (CHENNAI) PRIVATE LIMITED,1
TRIVENI IN-ORGANICS PRIVATE LIMITED,1
AQUASOL TECHNOLOGIES PRIVATE LIMITED,1
UNIPHASE CHEMICALS PRIVATE LIMITED,1
HEMALATHAA HI-CHEM PRIVATE LIMITED,1
AMRITA CHEMICALS (INDIA) PRIVATE LIMITED,1
VIJAY BIOTECH PRIVATE LIMITED,1
BUCKMAN LABORATORIES (INDIA) PRIVATE LIMITED,1
LUCKY BIOTECH DISCOVERIES PRIVATE LIMITE D,1
BHARATH COAL CHEMICALS LIMITED,1
REVEIRA ENERGY PRIVATE LIMITED,1
GLUESEAL PRIVATE LIMITED,1
ENVVIRO TECH SYSTEM AND CHEMICALS MFG PRIVATE LIMITED,1
SYNKROMAX SPECIALITIES PRIVATE LIMITED,1
SUDHIN BIOTECH PRIVATE LIMITED,1
NEEM GUARD ORGANICS LIMITED,1
R J CARBONS INDIA PRIVATE LIMITED,1
MAXPURE FILTECH INDIA PRIVATE LIMITED,1
VENMAR AGROCHEM INDIA PRIVATE LIMITED,1
BIOGREEN TECHNOLOGY PRIVATE LIMITED,1
GARUDA GLOBAL BIOCHEMICALS PRIVATE LIMITED,1
RASI CARBONS INDIA PRIVATE LIMITED,1
RANK BIO PRODUCTS INDIA PRIVATE LIMITED,1
NEOPHYLL AGRISCIENCES PRIVATE LIMITED,1
ORRANJE AGRI SCIENCE PRIVATE LIMITED,1
PARKER BIOTECH PRIVATE LIMITED,1
SRI SURYA AGRO TECH PRIVATE LIMITED,1
SICGILSOL INDIA PRIVATE LIMITED,1
GOODEARTH FERTILISERS COMPANY PRIVATE LIMITED,1
TRM BIOTECH PRIVATE LIMITED,1
PRIYAA BIO RADIANCE PRIVATE LIMITED,1
INDO AGRI LIMITED,1
ANDHRA FERTILIZERS LTD.,1
MADRAS PHOSPHATE MANUFACTURERS LTD,1
ARASAN FERTILISERS PRIVATE LIMITED,1
NITRO MIX PVT LTD,1
AGRO CHEMICALS PRODUCTS PRIVATE LIMITED,1
MYSORE FERTILISER COMPANY PRIVATE LIMITED,1
PYRO-CHEM PRIVATE LIMITED,1
TAMIL NADU ISPAT PARISHAD LTD.,1
EAST COAST PHARMACEUTICALS LIMITED,1
SREE ARUNAI AGRO CHEMICALS PRIVATE LIMITED,1
CROPCARE PRIVATE LIMITED,1
ENNORE CHEMICALS AND FERTILISERS PRIVATE  LIMITED,1
INDIAN SYNTANS INVESTMENTS PRIVATE LIMITED,1
AMMAN WOVENSACKS LIMITED,1
CHEMONATE INTERMEDIATERS PRIVATE LIMITED,1
VIJAY CHEMICALS AND INSECTICIDES MADRAS PRIVATE LIMITED,1
KOVEI PESTICIDE PRIVATE LIMITED,1
CHOLA CHEMPRO PRIVATE LIMITED,1
SHINEWELL GRANITES AND CHEMICALS PRIVATE  LIMITED,1
SUBIKSHAM CHEMICAL AND FERTILIZERS PVT L TD,1
SRI VEKKALIAMMAN FERTILISERS P LTD,1
TANTECH AGRO CHEMICALS LIMITED,1
SASI AGRO SERVICES AND INPUTS PVT LTD,1
VIJAY FERTILISERS PRIVATE LIMITED,1
LEO PETROCHEM PVT. LTD.,1
SAKTHI AGRO TECH PVT. LTD.,1
AGRIND SERVICES AND AGENCIES PVT. LTD.,1
VIJAYA CHEMAGRO INDIA PVT. LTD.,1
PRAGADESHWAR FERTILISERS PVT.LTD.,1
SYLVAN FARM CHEMICALS (TRICHY) PRIVATE LIMITED,1
TAMILNADU PESTICIDES AND CHEMICALS PRIVATE LIMITED,1
INTEGRATED AGRO SYSTEMS PRIVATE LIMITED,1
KEYCER AGRO CHEMICALS PRIVATE LIMITED,1
MADURAI AGRO CHEMICALS AND FERTILIZERS PRIVATE LIMITED,1
BHARAT FERTILISERS AND CHEMICALS PVT. LT D.,1
ACUBA CHEMICAL PROJECTS LIMITED,1
DEVI CROPSCIENCE PRIVATE LIMITED,1
BIO-KING PRIVATE LIMITED,1
MICRO FERTILIZERS PRIVATE LIMITED,1
CHAKRA ABRATECH PRIVATE LIMITED,1
SIV AGRO CHEMICALS PRIVATE LIMITED,1
PRIME RESIDENCIES PRIVATE LIMITED,1
OM SAKTHI PULVERISING AND SAW MILLS PRIVATE LIMITED,1
POPULAR FERTILIZER COMPANY PRIVATE LIMIT ED,1
BAY ORGANICS LIMITED,1
SOUTHERN BIO PROCESSORS PRIVATE LIMITED,1
ANUBHAV MICRO IRRIGATIONS SYSTEMS LTD,1
EXCEL BI0-LINKS PRIVATE LIMITED,1
MAHAVEER MICRONUTRIENTS PRIVATE LIMITED,1
JM BIO FERTILIZERS PRIVATE LIMITED,1
CEEGO LABS PRIVATE LIMITED,1
TRIEM AGRO INPUTS LIMITED,1
UNIVERSAL AGRO CHEMICALS LIMITED,1
NIKKY CHEM-FERT LIMITED,1
SIKAN NATURAL EXTRACTS LIMITED,1
ALPHA PESTICIDES PRIVATE LIMITED,1
MANGALA (FERTILIZERS & AGRO INPUTS) PRIV ATE LIMITED,1
TAMIL NADU BIO-TECHNOLOGIES PRIVATE LIMITED,1
ALPHO PEST CONTROL PRIVATE LIMITED,1
NECTAR BIOTECH LIMITED,1
MINCELL CHEMICAL INDUSTRIES LIMITED,1
PRANAVAM AGRO PRODUCTS (MADRAS) PRIVATE LIMITED,1
AQUA & ARTHROPODS PEST CONTROL PRIVATE LIMITED,1
WELLFARM AGRO CHEMICALS PRIVATE LIMITED,1
GROW WELL FERTILIZERS PRIVATE LIMITED,1
MARYGREEN AGROTECH PRIVATE LIMITED,1
RITHA FERTILISERS PRIVATE LIMITED,1
APOORVA BIO TECH PRIVATE LIMITED,1
PESTEC SERVICES PRIVATE LIMITED,1
DHANVANTRI ENTERPRISES PRIVATE LIMITED,1
GREENMARK AGRO INPUTS LIMITED,1
SREE BALAJEE FINE CHEMICALS COMPANY PRIV ATE LIMITED,1
AGRI GREEN FERTILIZERS & CHEMICALS PRIVATE LIMITED,1
MAG SUPREME CHEMICALS PRIVATE LIMITED,1
SUPERLITE PRODUCTS PRIVATE LIMITED,1
ORGANOMIX ECOSYSTEMS PRIVATE LIMITED,1
THE METTUR CHEMICAL AND INDUSTRIAL CORPORATION LIMITED,1
SUJATHA NATURAL ORGANIC AGRO PRODUCT PRIVATE LIMITED,1
BIOCROP PRIVATE LIMITED,1
BHUMAN FERTILISERS PRIVATE LIMITED,1
ELITE ORGANIC KOMPOST PRIVATE LIMITED,1
NILGIRI FERTILIZER PRIVATE LIMITED,1
SCIENTIFIC FERTILISER COMPANY PRIVATE LIMITED,1
DECCAN FERTILISER COMPANY (COIMBATORE) L IMITED,1
THE METTUR-FERTILISER COMPANY PRIVATE LIMITED,1
COIMBATORE PIONEER FERTILIZERS LIMITED,1
VENSONS AGRO CHEMICALS AND ALLIED INDUSTRIES PRIVATE LIMITED,1
JAYAKRISHNA PESTICIDES PRIVATE LIMITED,1
BIOGEN FERTILIZERS INDIA PRIVATE LIMITED,1
VALARSARA ECO TECH INDIA PRIVATE LIMITED,1
KUMARI ECO FRIENDLY FARMING SERVICES PRIVATE LIMITED,1
PRAVRTHI FERTILISERS (INDIA) PRIVATE LIM ITED,1
MERCURY FERTILIZERS PRIVATE LIMITED,1
RAMJAY CHEMICALS AND FERTILIZERS (INDIA)  PRIVATE LIMITED,1
PROWESS CHEMICALS AND FERTILIZERS (INDIA) PRIVATE LIMITED,1
ISHINN ORGANIC EXPORTS PRIVATE LIMITED,1
AURAPHYLL INNOVENTURES INDIA PRIVATE LIMITED,1
ASSOCIATED PESTICIDES PRIVATE LIMITED,1
GARUDA FERTILISORS & PESTICIDES PRIVATE LIMITED,1
NEEMACHTIN TECHNOLOGIES PRIVATE LIMITED,1
BIOTRACK TECHNOLOGY PRIVATE LIMITED,1
EMRALD BIOFERTILIZERS PRIVATE LIMITED,1
DHARMA ORGANIC PRIVATE LIMITED,1
KAMADENU BIOMASS PRIVATE LIMITED,1
GREEN GOLD FERTILIZERS PRIVATE LIMITED,1
AVENTUR BIO-CHEM PRIVATE LIMITED,1
KAAZHI BIO TECH PRIVATE LIMITED,1
CHLOROPHYLL CROP CARE PRIVATE LIMITED,1
ASHOK KUMAR FERTILIZER PRIVATE LIMITED,1
NEO NEEM EXTRACTIONS PRIVATE LIMITED,1
VENKATADARI CHEMICALS AND PHARMACEUTICAL S PRIVATE LIMITED,1
MERCURY CHEMICALS PRIVATE LIMITED,1
RAJENDRA BIO TECH PRIVATE LIMITED,1
K. N. CHARI RUBBER & PLASTICS PRIVATE LIMITED,1
IND-ITAL CHEMICALS LIMITED,1
CHEMICALS & PLASTICS INDIA LIMITED,1
GOVEL PLASTICS PRIVATE LIMITED,1
SOUTHERN SYNTHETICS LIMITED,1
BIO & SYNTHETIC CHEMICALS ( INDIA) PRIVATE LIMITED,1
PACKWELL THERMOPLAST PRIVATE LIMITED,1
SHREYAS ELASTOMERS PVT LTD,1
FIBRE BOND POLYESTERS PVT.LTD.,1
TAJ SYNTHETIC MARBLES PVT.LTD.,1
KMELOS APPARELS LIMITED,1
ANANDHI PIPES PRIVATE LIMITED,1
VASAVI BALA RESINS PRIVATE LIMITED,1
EXCEL COMPONENTS P. LTD,1
VIJAY PLAS FABS PRIVATE LIMITED,1
S.R.P.PLASTICS PVT. LTD,1
SUN CROWN POLYMERS PRIVATE LTD,1
POLYMAX INNOVATIONS LIMITED,1
MAGMA PIPE PRIVATE LIMITED,1
CONMAC ENGINEERING PVT. LTD,1
SPECTRUM ORGANICS PRIVATE LIMITED,1
STANDARD POLYPLAST (MADURAI) PVT. LTD,1
SUDHARSAN RESINS AND POLYMERS PVT. LTD,1
ISHWARYA SYNTHETIC RESINS PRIVATE LIMITED,1
SRI LAKSHMINARAYANAN PACKDAGING COMPANY PRIVATE LIMITED,1
CHENNAI AROMATICS PRIVATE LIMITED,1
PADMAVATI POLYMERS PRIVATE LIMITED,1
PARRY AGROCHEM EXPORTS LIMITED,1
PRECISION POLYMER PRODUCTS LIMITED,1
KAYCEE INDUSTRIAL CHEMICALS PRIVATE LIMITED,1
MICRO CHEM PRODUCTS(INDIA)PRIVATE LIMITED,1
DR.SARMA`S LABORATORIES PRIVATE LIMITED,1
MONICA POLYSACKS PRIVATE LIMITED,1
KOPSON SURFACTANTS PRIVATE LIMITED,1
SHIVAKASI POLYMERS PRIVATE LIMITED,1
CHAKRARAJA AUTO COMPONENTS (CHENNAI) PRI VATE LIMITED,1
S.M. ELASTOMERIC ENGINEERS PRIVATE LIMIT ED,1
K.M.C POLYTHENE PRIVATE LIMITED,1
MEENAM POLYMERS PRIVATE LIMITED,1
ROTO TRADING PRIVATE LIMITED,1
RAM-NATH & COMPANY PRIVATE LIMITED,1
SUPREME ROSIN PRIVATE LIMITED,1
ETA STAR WESTERN AUTO PRIVATE LIMITED,1
PRIMIA INDIA LUBES PRIVATE LIMITED,1
DC RESINS PRIVATE LIMITED,1
BEACON POLYMERS PRIVATE LIMITED,1
MILLENNIUM POLYCHEM PRIVATE LIMITED,1
ALAGAR RESINS PRIVATE LIMITED,1
VIBRANT INDUSTRIES PRIVATE LIMITED,1
RESICO (INDIA) PRIVATE LIMITED,1
ICOL CHEMICALS PRIVATE LIMITED,1
NEW V.V.B. JOTHIPRAKASAM PAINTS PRIVATE LIMITED,1
MEGA SHIELD COATING PRIVATE LIMITED,1
EXUBER CHEMICALS PRIVATE LIMITED,1
DINDIGUL COPSICUM RESINS PRIVATE LIMITED,1
SALEM RESINS PRIVATE LIMITED,1
M.N.POLYESTER (INDIA) PRIVATE LIMITED,1
ANOHA FOAM PRIVATE LIMITED,1
CHENNAI RESINS AND CHEMICALS PRIVATE LIMITED,1
SAINERGY FUEL CELL INDIA PRIVATE LIMITED,1
ARPITA FIBRES & CHEMICALS PRIVATE LIMITED,1
KLN CHEMICALS AND PLASTICS PRIVATE LIMIT ED,1
ITAN POLYFABS PRIVATE LIMITED,1
SREE BALAHA POLYMERS PRIVATE LIMITED,1
VENKATESHWARA FIBRE GLASS (CHENNAI) PRIVATE LIMITED,1
POLYMER TECHNOLOGIES INDIA PRIVATE LIMITED,1
EVERGREEN POLYMERS PRIVATE LIMITED,1
QUTE EXTRUSIONS PRIVATE LIMITED,1
MELVIN POLYMER PRIVATE LIMITED,1
ITAL PLASTIC COMPOUNDS PRIVATE LIMITED,1
POLYANNEX INDIA PRIVATE LIMITED,1
ANUJAN POLYMERS PRIVATE LIMITED,1
LITELON PRIVATE LIMITED,1
DURABLE FOAM (INDIA) PRIVATE LIMITED,1
ACCENT POLYMER INDUSTRIES PRIVATE LIMITED,1
VELAVEN POLYMERS PRIVATE LIMITED,1
SALLY THERMOPLASTIC INDIA LIMITED,1
DON CHEM PRIVATE LIMITED,1
VENUSS AUTOMOULDS PRIVATE LIMITED,1
FLUOROKRAFT PRIVATE LIMITED,1
BSQUARE PLASTEK PRIVATE LIMITED,1
BHAYANI PLASTIC INDIA PRIVATE LIMITED,1
P.I.P. POLYMERS PRIVATE LIMITED,1
KAMAL HEALTHCARE PRODUCTS PRIVATE LIMITED,1
URBANE INDUSTRIES LIMITED,1
SIGMA MECHNOPLAST PRIVATE LIMITED,1
GOLDEN FILAMENTS PRIVATE LIMITED,1
THENA POLYMERS PRIVATE LIMITED,1
PRIMO INDUSTRIAL POLYMERS PRIVATE LIMITE D,1
UNIMAC PLASTIC TECHNOLOGY PRIVATE LIMITED,1
MODULAR MOLD SOLUCTION PRIVATE LIMITED,1
COASTAL PLASTOCHEM PRIVATE LIMITED,1
SENTHIL PLASTICS PRIVATE LIMITED,1
SAMYU NATURE CARE PRIVATE LIMITED,1
BHAGWAN CHEMICAL & ENGINNERING INDUSTRIE S PRIVATE LIMITED,1
TCP LIMITED,1
CLENOL CHEMICALS PRIVATE LIMITED,1
SYNVIOL CHEMICALS PRIVATE LIMITED,1
MADRAS PROCESS CHEMICALS LIMITED,1
T K CHEMICAL ENTERPRISES PRIVATE LIMITED,1
CHEMOPOL COMPLEX (INDIA) PRIVATE LIMITED,1
CUBANE SPECIALITY CHEMICALS PRIVATE LIMITED,1
MEKUBA PETROLUBES PRIVATE LIMITED,1
ITAKEM FINECHEM PRIVATE LIMITED,1
WESLY PHARMACEUTICALS PRIVATE LIMITED,1
ANKESH IMPEX (INDIA) PRIVATE LIMITED,1
ASHOK RAJ IMPEX PRIVATE LIMITED,1
SURYAKANT PAINT ACCESSORIES PRIVATE LIMI TED,1
WILLOWNET EXIM PRIVATE LIMITED,1
ABS WATER TECH INDIA PRIVATE LIMITED,1
ROCKWELD ELECTRODES PRIVATE LIMITED,1
EXCELLENT CHEMICAL PRODUCTS PRIVATE LIMITED,1
UNISEAL ADHESIVES AND SEALANTS PRIVATE LIMITED,1
SRI LAKSHMI INDUSTRIAL COATINGS PRIVATE LIMITED,1
MAHARAJA GLOBAL MARKETING COMPANY PRIVATE LIMITED,1
NOBEL PHARMA & CHEMICALS PRIVATE LIMITED,1
CHENNAI OSCAR BIO PHARMACEUTICALS PRIVATE LIMITED,1
INDIA INGREDIENTS PRIVATE LIMITED,1
QUBE LABORATORIES PRIVATE LIMITED,1
VIA CERAMICS PRIVATE LIMITED,1
VIJAY ADHESIVES PRIVATE LIMITED,1
NEWGEN CONSTRUCTION CHEMICALS PRIVATE LIMITED,1
VISHWA-SYNTHARO PHARMACHEM PRIVATE LIMITED,1
DECKEN COATINGS PRIVATE LIMITED,1
VIJAYAM BIO CYTES (TAMIL NADU) PRIVATE LIMITED,1
G R CARBON PRIVATE LIMITED,1
ALAMELU MAGNESIA PRIVATE LIMITED,1
CAPTOS PHARMA PRIVATE LIMITED,1
DIVINE ATMOS PRIVATE LIMITED,1
HINDUSTHAN ANIMAL CARE PRIVATE LIMITED,1
GALPHA MED PHARMACEUTICALS PRIVATE LIMITED,1
SRI VANI DETERGENTS PRIVATE LIMITED,1
SUPER DP PRODUCTS PRIVATE LIMITED,1
TROPICAL AGRO SYSTEM (INDIA) PRIVATE LIMITED,1
RAM AGRO CHEMICAL INDUSTRIES LTD,1
EMERALD FRAGRANCE & COMPANY PVT LTD,1
GOLDEN REXINES (INDIA) PRIVATE LIMITED,1
RENTOKIL INDIA PRIVATE LIMITED,1
PESPRO SERVICES INDIA PRIVATE LIMITED,1
RAJSHREE BIOTECH PRIVATE LIMITED,1
FARM MINERALS AND CHEMICALS PRIVATE LIMITED,1
BOND CHEMICALS PVT LTD,1
ASWATHI CHEMICALS PRIVATE LIMITED,1
AGROSYNTH CHEMICALS PRIVATE LIMITED,1
ACL BIO PRODUCTS LIMITED,1
GEEYEIS AGROTECH PRIVATE LIMITED,1
BASARASS BIO CON (INDIA) PRIVATE LIMITED,1
CHENNAI PEST CONTROL PRIVATE LIMITED,1
SUNSHINE F.M.C.G.PRIVATE LIMITED,1
ALFINE ASSOCIATES PRIVATE LIMITED,1
AG ENVIRO BIOTECH PRIVATE LIMITED,1
ECOSMART TECHNOLOGIES PRIVATE LIMITED,1
BRACE REPELLENTS PRIVATE LIMITED,1
VIMKAR CONTRACTS WORKS PRIVATE LIMITED,1
GREEN TECH AGRO PRODUCTS PRIVATE LIMITED,1
CHAKRA CROP CARE PRIVATE LIMITED,1
GOODMORNING REPELLANTS PRIVATE LIMITED,1
SHRI VARI PHARMA PRIVATE LIMITED,1
ASHWANTH CHEMICALS PRIVATE LIMITED,1
NIKITA BIOAGRO PRIVATE LIMITED,1
SABARI CROP CARE SCIENCES PRIVATE LIMITED,1
HS PEST CONTROL PRIVATE LIMITED,1
PURPLE PESTO TECHNOLOGIES PRIVATE LIMITED,1
GODAVARI FARM CHEMICAL INDUSTRIES PRIVATE LIMITED,1
SREENIVASA METAKEM PRIVATE LIMITED,1
LIPTON PHARMACEUTICALS PRIVATE LIMITED,1
ANTRIKSH HEALTH CARE PRIVATE LIMITED,1
AG-GROW PRODUCTS LIMITED,1
LESLIE AGROCHEM PRIVATE LIMITED,1
MICROCLEAN PEST CONTROL PRIVATE LIMITED,1
AKSOL CHEMICALS PRIVATE LIMITED,1
ALTENE BIOTIQUA PRIVATE LIMITED,1
KOSHAA AGRO CHEMICALS PRIVATE LIMITED,1
A WAY OF LIFE HERBALS PRIVATE LIMITED,1
ANNAI BIO CHEM PRIVATE LIMITED,1
THENI AGRO FUEL LIMITED,1
LAINAD BIO & CHEMICAL PRODUCTS PRIVATE LIMITED,1
RAJ CROP SCIENCE (INDIA) PRIVATE LIMITED,1
SHREE SHIVA BIO TECH (INDIA) PRIVATE LIMITED,1
GRASSROOTS BIO-VENTURES PRIVATE LIMITED,1
J K K BIO SCIENCES PRIVATE LIMITED,1
KEYCER AGRO CHEMICALS LIMITED,1
GREEN CARE AGRO-TECH PRIVATE LIMITED,1
NEELAMALAI PESTICIDES AND CHEMICALS PRIV ATE LIMITED,1
ERODE PESTICIDES PRIVATE LIMITED,1
TOWER ENTERPRISES INDIA PRIVATE LIMITED,1
ORBIT NATURALS AND ORGANICS PRIVATE LIMI TED,1
SKYLAB HYGIENE INDIA PRIVATE LIMITED,1
EVEREST INKS & ALLIED PRODUCTS PRIVATE LIMITED,1
NURIT INKS PRIVATE LIMITED,1
WESTERN INDIA PAINT & COLOUR COMPANY PRIVATE LIMITED,1
SPARKLE SPECIALITY COATINGS & TRADING PRIVATE LIMITED,1
THEJA SUPERCOATINGS PRIVATE LIMITED,1
RAJA'S NEW TECHNO PLAST & PAINTS PRIVATE  LIMITED,1
SHINE PETTRO CHEM & RESINS (INDIA) PRIVATE LIMITED,1
N & F COLOURCARE INDIA PRIVATE LIMITED,1
SHELL COLOUR COATINGS PRIVATE LIMITED,1
CHENICS PAINT INDIA PRIVATE LIMITED,1
SREE VASTHU PAINTS PRIVATE LIMITED,1
TITAN HMG PAINTS INDIA LIMITED,1
CHEMINDIA COLOURCOATS PRIVATE LIMITED,1
ACETECH PRECISION COATS INDIA PRIVATE LIMITED,1
GENUINE WELBRO PAINTS INDIA PRIVATE LIMITED,1
AMTOUCH PAINTS AND PIGMENTS PRIVATE LIMITED,1
SHINY PAINTS PRIVATE LIMITED,1
AARIKA CHROMA INDUSTRIES PRIVATE LIMITED,1
AOTEARO METAL COATINGS PRIVATE LIMITED,1
ADIBA PAINTS PRIVATE LIMITED,1
MSK INDUSTRIES & PRODUCTS PRIVATE LIMITED,1
CHEMICALS ENTERPRISES PRIVATE LIMITED,1
JANATHACEM INDUSTRIES LIMITED,1
V.B. NATURAL COLOR SOLUTIONS PRIVATE LIMITED,1
MADRAS HARDWARE (SUNDRY) & PAINT MERCHANTS ASSOCIATION,1
ADDISONS PAINTS & CHEMICALS LIMITED.,1
MUTHU PAINT INDUSTRIES PRIVATE LIMITED,1
RAVI PAINTS AND CHEMICALS LTD,1
SPECTRO INKS AND PAINTS PRIVATE LIMITED,1
GNP MADRAS LIMITED,1
UNIPAINTS PRIVATE LIMITED,1
MONARK PRINTING INKS PRIVATE LIMITED,1
AGSAR PAINTS PRIVATE LIMITED,1
LUMINISOL PAINTS AND CHEMICLS PRIVATE LIMITED,1
VINJHA PAINTS PRIVATE LIMITED,1
COROMANDEL CABLES PRIVATE LIMITED,1
ARISTO PAINTS PRIVATE LIMITED,1
NELGAN CHEMICALS PRIVATE LIMITED,1
