Company,Tag
Pujarafoods LLP,1
LUXE,1
Sapphire Foods India Pvt. Ltd.,1
MD Garments World,1
MARKET NINETY NINE PVT. LTD.,1
MARKS SPENCER ,1
Marks and Spencer Reliance I Pvt Ltd.,1
CITYMAX HOTELS INDIA PVT. LTD,1
NAVNIK GLOBAL FASHION LLP,1
Welcome To MINISO,1
MOBILE ZONE,1
ADITYA BIRLA FASHION AND RETAIL LIMITED,1
Pantaloons,1
Lifestyle international Pvt. Ltd,1
COMORIN FIBRES PRIVATE LIMITED,1
SOUTHERN POULTRY INDUSTRIES PVT LTD.,1
VENI FARMS PRIVATE LIMITED,1
VASU FARMS PRIVATE LIMITED,1
SHIVA EGG PRODUCTS PRIVATE LIMITED,1
HIMAJA POULTRIES PRIVATE LIMITED,1
MAHESH GARDENS PRIVATE LIMITED,1
NILU FARMS PVT. LTD,1
SOMANATHAN EXPORTERS PRIVATE LIMITED,1
SHIV FARM PRODUCTS LIMITED,1
EGGCITY HATCHERIES LIMITED,1
LYDIA MARKETING SERVICES PRIVATE LIMITED,1
WHITE LINE POULTRY PRODUCTS PRIVATE LIMI TED,1
EUREKHA HATCHERIES PRIVATE LIMITED,1
KIRTHIKA POULTRY FARMS PRIVATE LIMITED,1
WELFARE POULTRY PRIVATE LIMITED,1
DEEPIKA POULTRY FARMS PRIVATE LIMITED,1
SRI ABIRAMI POULTRY FARM PRIVATE LIMITED,1
TRITAAN EGG PRODUCTS LIMITED,1
S.G.S. POULTRY FARMS PRIVATE LIMITED,1
OVAL PARK AGRO TECH AND FOODS PRIVATE LI MITED,1
UDAYAKRISHNA POULTRY FARMS PRIVATE LIMITED,1
RAMAKRISHNA POULTRY PRIVATE LIMITED,1
SAITECH BIO VENTURES PRIVATE LIMITED,1
VARSHINI POULTRY FARMING PRIVATE LIMITED,1
SARASWATHI BREEDERS PRIVATE LIMITED,1
MANGALRAJ POULTRY FARMS PRIVATE LIMITED,1
A.A.POULTRY FARMS PRIVATE LIMITED,1
SELVAM HATCHERIES PRIVATE LIMITED,1
A.V.M.HATCHERIES POULTRY BREEDING RESEARCH CENTRE PRIVATE LIMITED,1
SURYA HATCHERIES PRIVATE LIMITED,1
UNIKAY HATCHERIES PRIVATE LIMITED,1
SUPREME POULTRY PRIVATE LIMITED,1
AMBAL POULTRY PRIVATE LIMITED,1
SRI VENKATAACHALAPATHY POULTRY FARM PRIVATE LIMITED,1
RAJA POULTRIES PRIVATE LIMITED,1
SREETHAM FRAGO LIMITED,1
AKP POULTRY FARMS PRIVATE LIMITED,1
P K M SWAMY HATCHERY PRIVATE LIMITED,1
PIONEER HATCHERIES PRIVATE LIMITED,1
SUGUNA FOODS PRIVATE LIMITED,1
SINITHA CHICK SPECIALITY PRIVATE LIMITED,1
GOWRI POULTRY PRIVATE LIMITED,1
HEMANTH POULTRY FARMS PRIVATE LIMITED,1
GHP POULTRRY (INDIA) LIMITED,1
CHAKRA POULTRY FARMS PRIVATE LIMITED,1
K M POULTRY PRIVATE LIMITED,1
THIRUMURUGAN POULTRY FARMS PRIVATE LIMIT ED,1
A.M. POULTRY FARMS PRIVATE LIMITED,1
CHINDU POULTRY FARM PRIVATE LIMITED,1
ALUNKAL POULTRY FARMING AND HATCHERIES PRIVATE LIMITED,1
VANGILI HATCHERIES PRIVATE LIMITED,1
PVRSM BROILERS AND HATCHERIES PRIVATE LIMITED,1
ANNAI POULTRY FARMS PRIVATE LIMITED,1
SRI ANNAI HATCHERIES PRIVATE LIMITED,1
K K HATCHERIES PRIVATE LIMITED,1
INDIAN POULTRIES PRIVATE LIMITED,1
D.R.POULTRY FARMS PRIVATE LIMITED,1
D.R.EGG EXPORTS PRIVATE LIMITED,1
NOVARY POULTRY PRIVATE LIMITED,1
P.S.S. POULTRY FARM PRIVATE LIMITED,1
SPF POULTRIES (UDUMALAI) PRIVATE LIMITED,1
POORANI HATCHERIES PRIVATE LIMITED,1
BEST BROILER FARMS INDIA PRIVATE LIMITED,1
BEST BREEDING FARMS INDIA PRIVATE LIMITED,1
BEST HATCHERIES COIMBATORE PRIVATE LIMITED,1
R S BREEDING FARM AND HATCHERIES PRIVATE  LIMITED,1
POORANI POULTRY FARM PRIVATE LIMITED,1
SHANTHI HATCHERIES PRIVATE LIMITED,1
SASTIKUMAR FARMS AND FOODS PRIVATE LIMITED,1
NIVETHA POULTRY FARM PRIVATE LIMITED,1
PKV BIO FAARM PRIVATE LIMITED,1
PIONEER BREEDING AND HATCHERIES PRIVATE LIMITED,1
DADDYS POULTRY FARM INDIA PRIVATE LIMITED,1
N R S POULTRY FARMS PRIVATE LIMITED,1
SENTHILANDAVAR POULTRY FARMS PRIVATE LIMITED,1
SERUKKUR POULTRY FARM PRIVATE LIMITED,1
SHANTHI FORTUNE INDIA PRIVATE LIMITED,1
PREETHIKA EMU EXIM PRIVATE LIMITED,1
ANURAGHA POULTRIES AND BREEDERS PRIVATE LIMITED,1
PAVITHA POULTRY FARM PRIVATE LIMITED,1
GLORY EMU HATCHERIES PRIVATE LIMITED,1
SRI KARUMANNAN POULTRY FARM PRIVATE LIMITED,1
RANA BREEDING FARMS INDIA PRIVATE LIMITED,1
RASI POULTRIES PRIVATE LIMITED,1
SHANTHI FEEDS PRIVATE LIMITED,1
AVIAGEN INDIA POULTRY BREEDING COMPANY PRIVATE LIMITED,1
BHARANI EGGSELL PRIVATE LIMITED,1
CHELLAM POULTRY FARM PRIVATE LIMITED,1
THIRUMAGAL POULTRY FARMS PRIVATE LIMITED,1
VC EMU FAARMS INDIA LIMITED,1
GRS EMU HATCHERIES AND BREEDING FARMS PR IVATE LIMITED,1
GNANASHRISTI FARMS INDIA PRIVATE LIMITED,1
VISWAS EMU FARMS INDIA PRIVATE LIMITED,1
SUPREME HATCHERIES AND PROTEINS INDIA PRIVATE LIMITED,1
PONNI HATCHERIES PRIVATE LIMITED,1
RPS FARMS AND EXPORTS PRIVATE LIMITED,1
SHRI VEERA KUMARASAMY POULTRY FARM PRIVATE LIMITED,1
SUSI EMU FARMS (INDIA) PRIVATE LIMITED,1
AISHWARYA BROILERS PRIVATE LIMITED,1
JEEVAN EMU CARE INDIA PRIVATE LIMITED,1
QUEEN EMU FARMS INDIA PRIVATE LIMITED,1
GENESIS POULTRY FOODS PRIVATE LIMITED,1
SWAMI CHICKENS PRIVATE LIMITED,1
V R G EMU AND POULTRY FARM PRIVATE LIMITED,1
MANORAJ BREEDERS PRIVATE LIMITED,1
SUVI EMU FARMS (INDIA) PRIVATE LIMITED,1
RAYBAN FEEDS AND HATCHERIES PRIVATE LIMITED,1
SGNS FARMS PRIVATE LIMITED,1
OPTIMA POULTRY PRIVATE LIMITED,1
G1 EMU'S ZONE INDIA PRIVATE LIMITED,1
AMMAN EMU FARMS & HATCHERIES (INDIA) PRIVATE LIMITED,1
REKHA EMU FARMS INDIA PRIVATE LIMITED,1
SENNAR FARM PRIVATE LIMITED,1
G1 EMU'S EXPORT INDIA PRIVATE LIMITED,1
TAMIZH EMU FARMS INDIA PRIVATE LIMITED,1
GANPAT EMU HATCHERY PRIVATE LIMITED,1
NS EMU FARMS INDIA PRIVATE LIMITED,1
ESHA EMU FARMS INDIA PRIVATE LIMITED,1
JAYAM EMU FARMS PRIVATE LIMITED,1
JPR EMU AGRI FARMS INDIA PRIVATE LIMITED,1
SIMBU EMU FARMS PRIVATE LIMITED,1
SUTHI EMU FARMS PRIVATE LIMITED,1
SURYA EMU FARMS PRIVATE LIMITED,1
EVEREST EEMU FARMS PRIVATE LIMITED,1
S M EMU AGRI FARMS PRIVATE LIMITED,1
GANGOTHIREE LIVESTOCK & FEEDS PRIVATE LIMITED,1
MALLIS POULTRY PRIVATE LIMITED,1
ERODE GREEN FARMS & POULTRY INDIA PRIVATE LIMITED,1
KURUNJI POULTRY FARMS INDIA PRIVATE LIMITED,1
BHARANI EMU FARMS INDIA PRIVATE LIMITED,1
JOTHIVEL EMU FARMS PRIVATE LIMITED,1
KRISHNAPOULTRY FARM INDIA PRIVATE LIMITED,1
RAPI'S EMU FARMS PRIVATE LIMITED,1
R.P.S. POULTRY FARM PRIVATE LIMITED,1
NITHI EMU FARMS INDIA PRIVATE LIMITED,1
THIRUMAGAL EMU AND AGRI FARMS PRIVATE LIMITED,1
UTHAYAA POULTRY FARMS INDIA PRIVATE LIMITED,1
KONGUNAADU EMU AND POULTRY FARMS PRIVATE  LIMITED,1
JAI EMU FARMS PRIVATE LIMITED,1
ASKAR EMU FARMS INDIA PRIVATE LIMITED,1
SRY EMU FARMS INDIA PRIVATE LIMITED,1
PASUMAI EMU FARMS INDIA PRIVATE LIMITED,1
SEVEN STAR POULTRY FARMS INDIA PRIVATE LIMITED,1
BEST EMU FARMS PRIVATE LIMITED,1
NILA EMU FARMS INDIA PRIVATE LIMITED,1
SMITH EMU & POULTRY FARMS PRIVATE LIMITED,1
BABY EMU FARMS (INDIA) PRIVATE LIMITED,1
SENTHAMIL POULTRY FARM INDIA PRIVATE LIMITED,1
ABI EMU AND AGRO FARMS INDIA PRIVATE LIMITED,1
HEALTHY POULTRY AND FARMS INDIA PRIVATE LIMITED,1
BANNARI AMMAN CROFT AND POULTRY PRIVATE LIMITED,1
FARMMER EEMU PRIVATE LIMITED,1
THAAI EMU FARMS INDIA PRIVATE LIMITED,1
SREE NITHYA EMU AND POULTRY FARM INDIA PRIVATE LIMITED,1
SIBI EMU FARMS PRIVATE LIMITED,1
NITHI POULTRY FARMS INDIA PRIVATE LIMITED,1
GURU CHICK FARMS INDIA PRIVATE LIMITED,1
PASUMAI POULTRY FARMS PRIVATE LIMITED,1
AGNI COPRA & POULTRY FARMS INDIA PRIVATE  LIMITED,1
R K EMU AND POULTRY BREEDERS PRIVATE LIMITED,1
GREEDAM POULTRY FARMS INDIA PRIVATE LIMITED,1
BHAARATH EMU FARMS PRIVATE LIMITED,1
SALEM SOORIYA POULTRY AND EMU FARMS INDIA PRIVATE LIMITED,1
RUDHRA POULTRY FARM PRIVATE LIMITED,1
SRI SAKTHI EMU AND POULTRY FARMS INDIA PRIVATE LIMITED,1
JAAYAAM POULTRY FARMS PRIVATE LIMITED,1
RATHI POULTRY AGRO FARMS PRIVATE LIMITED,1
SKY EMU FARM INDIA PRIVATE LIMITED,1
GREEN FIELD POULTRY INDIA PRIVATE LIMITED,1
SHRI SHIVA JOTHI EMU FARMS INDIA PRIVATE  LIMITED,1
VASANTHAM EMU & POULTRY FARMS INDIA PRIVATE LIMITED,1
KONGU POULTRY FARMS PRIVATE LIMITED,1
CAUVERY POULTRIES PRIVATE LIMITED,1
ERODE EVER GREEN POULTRY FARMS INDIA PRIVATE LIMITED,1
ANGALAMMAN AGRO FARMS AND HATCHERIES INDIA PRIVATE LIMITED,1
RAIN TREE AGRO FARMS (INDIA) PRIVATE LIMITED,1
NILGIRI EMU FARMS INDIA PRIVATE LIMITED,1
RAMACHANDRA HATCHERIES PRIVATE LIMITED,1
BRIGHT EMU FARMS PRIVATE LIMITED,1
SIVASAKTHI POULTRY FARMS INDIA PRIVATE LIMITED,1
SREE JEEVI POULTRY FARMS INDIA PRIVATE LIMITED,1
ULAVAN EMU AND POULTRY FARMS INDIA PRIVATE LIMITED,1
ERODE PUTHIYA PASUMAI POULTRY FARMS INDIA PRIVATE LIMITED,1
SRI CHAKRA EMU & POULTRY FARMS INDIA PRIVATE LIMITED,1
VASANTHAM AGRO FARMS AND HATCHERIES INDIA PRIVATE LIMITED,1
EVERGREEN EMU FARMS INDIA PRIVATE LIMITED,1
SIMO FARMS PRIVATE LIMITED,1
GNANAJOTHI AGRO & POULTRY FARMS INDIA PRIVATE LIMITED,1
DHANAM POULTRY FARM PRIVATE LIMITED,1
KIRIYA VET FARMS PRIVATE LIMITED,1
AGRI SWARNA FARM ESTATES PRIVATE LIMITED,1
HY-LINE LAYERS PRIVATE LIMITED,1
PLUS POULTRY FARM PRIVATE LIMITED,1
KEM POULTRIES PRIVATE LIMITED,1
JOTHI POULTRY FARM PRIVATE LIMITED,1
VNR AGRO AND DAIRY FARMS INDIA LIMITED,1
ADVANCE NATURAL PRODUCTS PRIVATE LIMITED,1
K P K BREEDER AND FEEDS PRIVATE LIMITED,1
PSV EGG PRODUCTS PRIVATE LIMITED,1
VENNILA POULTRY FARMS PRIVATE LIMITED,1
PASUMPON WATTLE EXTRACTION PRIVATE LIMIT ED,1
NATURE'S NECTAR WELLNESS (OPC) PRIVATE LIMITED,1
INSTANT FOODS & ALLIED INDUSTRIES PRIVATE LIMITED,1
DELTA BROILER FARM PVT LTD,1
TUTICORIN POULTRY FARM PVT LTD,1
SHORELINE FARMS PRIVATE LIMITED,1
AMMI FOODS AND FARMS PRODUCTS PRIVATE LI MITED,1
MARUTHI INTEGRATED FISHERIES PVT. LTD.,1
CAMARON AQUA FARMS PVT. LTD.,1
VICTOR FARMS PRIVATE LIMITED,1
SRI RAMACHANDRA CATTLE FEED INDUSTRY PVT  LTD,1
KUMARESAN FARMS PRIVATE LIMITED,1
CENTURY DAIRIES PRIVATE LIMITED,1
TAMILNADU HATCHERIES P. LTD,1
S&S LIVESTOCK PRIVATE LIMITED,1
TRISUL AGRO-LIVESTOCK RANCH LIMITED,1
A S MUTHU FARMS AND RESORTS LTD,1
DHARMA RANCH LIMITED,1
SRI ANJANEYA FARMS PRIVATE LIMITED,1
INDU POULTRY FARMS PRIVATE LIMITED,1
K.J.R.POULTRY FARM PRIVATE LIMITED,1
YENNES INFOTEC PRIVATE LIMITED,1
PONKAILASH POULTRY PRIVATE LIMITED,1
MULTIPLE POULTRIES PRIVATE LIMITED,1
VGM GOAT FARM PRIVATE LIMITED,1
CHALUKIYA ANIMAL FARMS PRIVATE LIMITED,1
MERINO DAIRY AND SHEEP FARM P LTD,1
SURABHI FARMS AND RESORTS LIMITED,1
CLASSIC MILK FOOD LIMITED,1
KATHIROAN FARMS (INDIA) LIMITED,1
MESHA FAARMS INDIA PRIVATE LIMITED,1
TRICHY CATTLE FARAMS P LTD,1
KEERTHI GOAT FARMS P LTD,1
CAPRICON AGRO EXPORTS PRIVATE LIMITED,1
SHOLINGHUR LIVESTOCK COMPANY PRIVATE LIM ITED,1
KARTIKEYA FARMS PRIVATE LIMITED,1
INLAND LIVESTOCK & AGRO DEVELOPERS PRIVATE LIMITED,1
OASIS GOAT FARMS PRIVATE LIMITED,1
IDEAL CHICK MEAT PACKERS PRIVATE LIMITED,1
A - ONE SHEEP FARMS PRIVATE LIMITED,1
EERATTIL POULTRY & AGRO FARM PRIVATE LIMITED,1
AVINASH CATFARM PRIVATE LIMITED,1
SIVANANDA CATTLE BREEDING AND EXPORT PRI VATE LIMITED,1
BAIRAHA DESI FARMS (INDIA) PRIVATE LIMIT ED,1
TMG AGRO SOLUTIONS PRIVATE LIMITED,1
COAKERS AGRO PRIVATE LIMITED,1
ANSHAS PUPPY DREAMS PRIVATE LIMITED,1
SANMARGAM FARMS (INDIA) PRIVATE LIMITED,1
RUSHMORE AGROFARMS PRIVATE LIMITED,1
CAMPBALLABAD FARMS PRIVATE LIMITED,1
TAMILNADU STATE FARMS CORPN LIMITED,1
LVR FARMS PRIVATE LIMITED,1
S G FARMS AND POULTRIES PVT. LTD.,1
KALASAKTHI AGRO PRIVATE LIMITED,1
YADSREE ROYAL AGRO FARMS PRIVATE LIMITED,1
FASI FARMS PRIVATE LIMITED,1
SHINE AGROTECH INDIA LIMITED,1
NFL AGRO FARM LIMITED,1
POTTAL PLANTATIONS PRIVATE LIMITED,1
GREENGRASS INFRA PRIVATE LIMITED,1
VM AGRO FARMS (INDIA) LIMITED,1
L & N MEDRA AGRO PRIVATE LIMITED,1
MADURA ORCHARDS LIMITED,1
KONGU NADU FARMS PRIVATE LIMITED,1
GREEN ACRES RANCH PRIVATE LIMITED,1
P P FARMS PRIVATE LIMITED,1
AGRO POWERSS (INDIA) PRIVATE LIMITED,1
ANIMAL GERMPLASM PRIVATE LIMITED,1
ANJU FARMS PRIVATE LIMITED,1
P S P FARMS PRIVATE LIMITED,1
HOSUR COIR FOAMS PRIVATE LIMITED,1
KODAI LAKSHMIPATHY AGRO FARM PRIVATE LIM ITED,1
KRK FARMS AND PLANTATIONS PRIVATE LIMITED,1
BATHRAKALI AMMAN FARMS PRIVATE LIMITED,1
BANNARIAMMAN FARMS PRIVATE LIMITED,1
INDIA AGRO PRODUCTS PRIVATE LIMITED,1
KURUTHAMALAI MURUGAN FORMS PRIVATE LIMIT ED,1
KTG PLANTATIONS PRIVATE LIMITED,1
V.S.K. SUGANYA AGRICULTURAL FARMS PRIVATE LIMITED,1
V S K PRAVEENA AGRICULTURAL FARMS PRIVATE LIMITED,1
SRI VENKATESHWARA PLANTATIONS PRIVATE LIMITED,1
GIRI AGRO FARMS PRIVATE LIMITED,1
JAYASAKTHI AGRO PLANTATIONS LIMITED,1
SHANTHA AGRO FARMS PRIVATE LIMITED,1
MEENA AGRO FARMS PRIVATE LIMITED,1
MURTHY AGRO FARMS PRIVATE LIMITED,1
RAMASWAMY AGRO FARMS PRIVATE LIMITED,1
UNIVERSAL AGRO PRODUCE EXPORTS PRIVATE L IMITED,1
SU AGRO FARMS PRIVATE LIMITED,1
CNK AGRO FARMS PRIVATE LIMITED,1
T.N.T. AGRO FARMS PRIVATE LIMITED,1
PVS AGRO FARM PRIVATE LIMITED,1
SUDARSHINI FARMS PRIVATE LIMITED,1
RARE EARTH AGRO AND LIVE STOCK LIMITED,1
INDHU VIGNESH FARMS PRIVATE LIMITED,1
R P V AGRO PRODUCTS PRIVATE LIMITED,1
APEAR FARMS PRIVATE LIMITED,1
NITHIN AGRO PRODUCTS PRIVATE LIMITED,1
SRI ARTHANAREESWARA FARMS PRIVATE LIMITED,1
VADIVELAN ENTERPRISES PRIVATE LIMITED,1
KADAMBUR BIO TECH AGRE FARMS PRIVATE LIM ITED,1
G.G.P. FARMS PRIVATE LIMITED,1
ELLORA AGROVET FARMS PRIVATE LIMITED,1
CHANDRAPOORNA AGRO FARM PRODUCTS PRIVATE  LIMITED,1
PUSHPAGIRI HORTICULTURE RESEARCH FARM PRIVATE LIMITED,1
M.S.J. FARMS PRIVATE LIMITED,1
VELLAKOIL HORTICULTURE RESEARCH FARM PRIVATE LIMITED,1
WESTCREEK FARMS AND RESORTS PRIVATE LIMITED,1
TAMARAI AGRO FARMS PRIVATE LIMITED,1
POLLACHI DAIRY FARMS PRIVATE LIMITED,1
VALARMATHI FARMS PRIVATE LIMITED,1
SRI GANAPATHY MARINE FIN FISH HATCHERY PRIVATE LIMITED,1
KODAI INDUSTRIES PRIVATE LIMITED,1
ANITHAA FARMS PRIVATE LIMITED,1
HERBARNS FARMS INDIA PRIVATE LIMITED,1
KALLAL AGRO FARMS PRIVATE LIMITED,1
JRS AGRI FARMS PRIVATE LIMITED,1
ARVIND SAKTHI AGRO FARMS PRIVATE LIMITED,1
ASHWIN POULTRY FARMS INDIA PRIVATE LIMIT ED,1
CHARISMA FARMS (COIMBATORE) PRIVATE LIMITED,1
AMAZON AGRO FARMS COVAI PRIVATE LIMITED,1
RANA FARMS AND FOODS PRIVATE LIMITED,1
RKB ENTERPRISES PRIVATE LIMITED,1
CBJ AGRO FARMS PRIVATE LIMITED,1
SIRAGIRI FARMS INDIA PRIVATE LIMITED,1
SRI SIVANMALAIANDAVAR AGRO & POULTRY FARMS INDIA PRIVATE LIMITED,1
SUCCESSFUL AGRO PRODUCT (INDIA) PRIVATE LIMITED,1
PALANISAMY CATTLE AND AQUACULTURE PRIVATE LIMITED,1
AGRI LAKSHMI NARASHIMA FARM ESTATES INDIA PRIVATE LIMITED,1
LINGA AGRO FARMS PRIVATE LIMITED,1
PERIASHOLA TEA FACTORY PRIVATE LIMITED,1
METTUR CARBONATES PRIVATE LIMITED,1
RAJA RAJAN MINERALS PRIVATE LIMITED,1
SRISHTI AGRO FOUNDATIONS PRIVATE LIMITED,1
VEL AGRO YARD COMPANY PRIVATE LIMITED,1
S M FEEDS & FARMS (INDIA) PRIVATE LIMITED,1
KARISAL AGRO FARMS PRIVATE LIMITED,1
EQUATOR RAW MATERIALS (I) PRIVATE LIMITED,1
AGROCROPS EXIM LIMITED,1
FIRST STEP ENTERPRISES PRIVATE LIMITED,1
NELLAI SHELTERS PRIVATE LIMITED,1
PEERSHA AGRO-TECH PRIVATE LIMITED,1
FIRST CHOICE AGRO PRIVATE LIMITED,1
M J HORTICULTURE PRIVATE LIMITED,1
HARITA GREENS PRIVATE LIMITED,1
DYNAMIC FRESH STORETEK PRIVATE LIMITED,1
MACRO TECH AGRO FARMS PRIVATE LIMITED,1
MANGALAM KRISHI VANIJYA PRIVATE LIMITED,1
ANNAI AGROTECH LIMITED,1
APS AGROTECH LIMITED,1
AROKYA AGROTECH LIMITED,1
PANDIANADU AGRO FARMS LIMITED,1
MEENAKSHI AGRI PROMOTERS PRIVATE LIMITED,1
SAY-SO AGRO FARM PRIVATE LIMITED,1
RADHA PLANTATIONS PRIVATE LIMITED,1
BELL AGRO FARMS PRIVATE LIMITED,1
KUMARAGURU GARDENS PRIVATE LIMITED,1
ASIRWAD CROPCARE PRIVATE LIMITED,1
SIVAKUMAR FLORICULTURE COMPANY PRIVATE L IMITED,1
SWAYAMBHU BIOLOGICS PRIVATE LIMITED,1
HINDUSTAAN AGRI (INDIA) LIMITED,1
VEDHAN GOAT FARMS INDIA LIMITED,1
THATHIENGARPETTAI PRECISION FARM COMPANY  LIMITED,1
MAKKAL DESHAM AGROTECH LIMITED,1
PARKRUTHI AGRO FOODS LIMITED,1
JV PANDIAN PLANTATIONS LIMITED,1
MAXIMAS DAIRY'S & AGRO FARM LIMITED,1
ABUEMPIRE AGRO FARM INDIA LIMITED,1
NAV AGRO PRIVATE LIMITED,1
CHELLAMMA FARM PRODUCT PRIVATE LIMITED,1
K M P AGROTECH PRIVATE LIMITED,1
UNIQUE AGRI INDIA PRODUCTS PRIVATE LIMITED,1
ALL SEASON LANDSCAPE PRIVATE LIMITED,1
SIGARAM AGRO FOODS INDIA PRIVATE LIMITED,1
INDIAN SUN AGRO PRIVATE LIMITED,1
MNM GREEN HARVEST PRIVATE LIMITED,1
NILE AGRO FARMS AND PRODUCTS PRIVATE LIMITED,1
JANAKI HI-TECH AGRO PRIVATE LIMITED,1
SENGALTHERI PLANTATIONS PRIVATE LIMITED,1
KALAKADU PLANTATIONS PRIVATE LIMITED,1
MARUTHAM DEVELOPMENT AND TECHNOLOGICAL SERVICES INDIA PRIVATE LIMITED,1
INDHU AGRO FARM PRIVATE LIMITED,1
MULLAI PLANTATIONS PRIVATE LIMITED,1
POTHIGAI PLANTATIONS PRIVATE LIMITED,1
SHRIWIN AGRO REACH INDIA PRIVATE LIMITED,1
ASHVEN AGRO INDUSTRIES PRIVATE LIMITED,1
MARUDHAM PLANTATIONS PRIVATE LIMITED,1
V UNITED EXPORTS PRIVATE LIMITED,1
J J AGRICULTURAL MARKETING SERVICE PRIVATE LIMITED,1
THIRUTHANGAL AGRI PRIVATE LIMITED,1
TAMMERA AGRO FARMS PRIVATE LIMITED,1
EAST COAST PRODUCER COMPANY LIMITED,1
SUPER GOOD AGROW PRIVATE LIMITED,1
PERALAM FARMS PRIVATE LIMITED,1
NANILAM AGRO TECH PRIVATE LIMITED,1
KALIAKUDI AGRO FARMS PRIVATE LIMITED,1
NEED SERVICES AGRICULTURE AND ENTERPRISES PRIVATE LIMITED,1
PAVI AGRO TECH INDIA PRIVATE LIMITED,1
AIYAN DAIRY FARM INDIA PRIVATE LIMITED,1
AROHANA AGRI SERVICES PRIVATE LIMITED,1
ANRAJ ORGANIC AGRO FARMS PRIVATE LIMITED,1
ANNAKILI AGRO FARM PRIVATE LIMITED,1
MANOJI PURNIMA POULTRY FARMS PRIVATE LIMITED,1
TARA ECO-FARMS PRIVATE LIMITED,1
FARMERS RURAL AGRI PARK PRIVATE LIMITED,1
AALAMPANNAI HOLISTIC INITATIVES PRIVATE LIMITED,1
ROHINI PRIYANKA EXIM PRIVATE LIMITED,1
ARROWW AGRI PRIVATE LIMITED,1
BEAULINE AGRI TECH PRIVATE LIMITED,1
STN AGRI PRIVATE LIMITED,1
STANDARD BOTANICALS PRIVATE LIMITED,1
INDSOIL AGROPROCESSING CONSORTIUM PRIVATE LIMITED,1
JAYARAJ PLANTATIONS PRIVATE LIMITED,1
SRI MEENAKSI TREE PLANTATION PRIVATE LIMITED,1
C. M. BIOFARM PRIVATE LIMITED,1
DEVI PLANTATIONS PRIVATE LIMITED,1
EGGRYCULTURE AND FARMS PRIVATE LIMITED,1
POLESTAR PLANTATION PRIVATE LIMITED,1
FARM CIRCLE EQUIPMENTS PRIVATE LIMITED,1
SAMUDBHAVA AGRO PRIVATE LIMITED,1
INDIAN MARINE AGRICULTURE PRIVATE LIMITE D,1
GREEN MOUNTAIN AGRO FARM INDIA LIMITED,1
ARS AGRO FARMS LIMITED,1
HDS DAIRIES AND ALLIED LIMITED,1
CUMBUM VALLEY GRAPE GROWERS' COMPANY LIMITED,1
PS RESORT AGRO TECH LIMITED,1
RELICA AGRO FARMS & ESTATES LIMITED,1
B.A.C.L AGROTECH INDIA LIMITED,1
SGS AGROTECH INDIA LIMITED,1
JCS AGRO FARMS LIMITED,1
ACEWIN BIOTECH INDIA LIMITED,1
KOTHARI GLOBAL VENTURES LIMITED,1
VINSURABI AGRO TECH LIMITED,1
SERD GREEN WEALTH LIMITED,1
VLC AGROTECH LIMITED,1
ELISE AGRO INDIA LIMITED,1
SENSE AGRO FARMS AND ESTATES INDIA LIMITED,1
GREEN TECH DEVELOPMENT FARMS INDIA LIMITED,1
SUN SAI LIFE AGROTECH(INDIA) LIMITED,1
DWE AGRO PRIVATE LIMITED,1
VEDHA FARMS PRIVATE LIMITED,1
MANINDRA AGRO FARMS PRIVATE LIMITED,1
ADITYA PLANTATIONS PRIVATE LIMITED,1
APOORVA AGRICO PRIVATE LIMITED,1
NANJIL AGRICULTURAL PRODUCER COMPANY LIMITED,1
A A A HUSBANDRY PRIVATE LIMITED,1
NANNILAM AGRARIAN PRODUCER COMPANY LIMITED,1
AMEYA ORCHARDES PRIVATE LIMITED,1
BHADRAK PLANTATIONS PRIVATE LIMITED,1
PARAMJEET PLANTATIONS PRIVATE LIMITED,1
INTIGRATED PRIMERY PRODUCER COMPANY LIMITED,1
MEGA MUSHROOM FARM PRIVATE LIMITED,1
FARM AGRO EXIM PRIVATE LIMITED,1
EVERGREEN HORTIPLANTATION PRIVATE LIMITED,1
VEDHAM CASHEW PRODUCER COMPANY LIMITED,1
NACHALUR FARMERS PRODUCER COMPANY LIMITED,1
VISHWA ARBORETUM PRIVATE LIMITED,1
GREEN INDIA GOAT AND DAIRY FARMS PRIVATE  LIMITED,1
JOLLY FARMER PRIVATE LIMITED,1
SUN LAND AGRI PRIVATE LIMITED,1
KALVARAYAN HILLS AGRO FARMS PRIVATE LIMITED,1
WINNERS AGRI WORLD PRIVATE LIMITED,1
MARUTHI MOOLIGAI PRODUCER COMPANY LIMITED,1
VALAMAI COMTRADE PRIVATE LIMITED,1
MGP AGRO AND MEDIICARE PRIVATE LIMITED,1
P.M.K.S AGRO (INDIA) PRIVATE LIMITED,1
PERIASAMY FARMS PRIVATE LIMITED,1
FUTUREGEN AGRO FARMS PRIVATE LIMITED,1
SHRI KUBERA GANAPATHY FARMS PRIVATE LIMITED,1
SARGURU MILK CENTRE PRODUCER COMPANY LIMITED,1
HARIDHRA HERBALS PRIVATE LIMITED,1
SMSK AGRI FARMS PRIVATE LIMITED,1
DHEVANATHAN ESTATES & PLANTATIONS PRIVATE LIMITED,1
SURABHI BIO-RESURGENCE PRIVATE LIMITED,1
ASTRA DAIRY FARMS PRIVATE LIMITED,1
SAFARI AGAR & WOODS PRIVATE LIMITED,1
PBS GO-GREEN PRIVATE LIMITED,1
SAVERAA EXPORTS COMPANY PRIVATE LIMITED,1
V M AGRICULTURE ESTATE PRIVATE LIMITED,1
PONNI FARMS PRIVATE LIMITED,1
VIDYA GREEN FARMS PRIVATE LIMITED,1
Y.V.S. AGRO FARMS PRIVATE LIMITED,1
WILD INTERNATIONAL COMMERCE PRIVATE LIMITED,1
SAMUTHRA INDIA PRODUCER COMPANY LIMITED,1
HITECH FARMS & LIVESTOCK PRIVATE LIMITED,1
GDS AGRO PROMOTER INDIA LIMITED,1
JAYAM DAIRIES & AGROTECH INDIA LIMITED,1
POWERFUL AGROTECH LIMITED,1
AMAZON GREEN AGRO FARM INDIA LIMITED,1
SUBAM AGRO TECH INDIA LIMITED,1
TRICHY AGRO LIMITED,1
PEOPLE LIFE CARE DIARIES AND AGROTECH INDIA LIMITED,1
FRANGIPANI ORCHARDS PRIVATE LIMITED,1
GREEN HAMMOCK AGRO PRIVATE LIMITED,1
GREEN DUNES AGRO FARM PRIVATE LIMITED,1
AURRUM ORGANIC HORTICULTURE PRIVATE LIMITED,1
AADHITYA TRADERS MANUFACTURES OF AGRO PRODUCTS PRIVATE LIMITED,1
MNS IMPEX PRIVATE LIMITED,1
LIZ AGRI PRODUCER COMPANY LIMITED,1
RAJ ECO VENTURES PRIVATE LIMITED,1
MVS COCONUT TRADING PRIVATE LIMITED,1
AMARAVATHI ECOFARMS PRIVATE LIMITED,1
S.G.V AGROFARMS ESTATE PRIVATE LIMITED,1
POTHIGAI FARMS PRIVATE LIMITED,1
BANGARU KAMAKSHIAMMAN AGRO FARMS PRIVATE  LIMITED,1
NOBLE AGRO BIOTECH PRIVATE LIMITED,1
REVPL AAGRO RESEARCH PRIVATE LIMITED,1
JUNGLE ECO FARMS PRIVATE LIMITED,1
ALMAA SIDDHA CARE MULTI SPECIALITY HOSPITAL INDIA PRIVATE LIMITED,1
PERIYAVAN AGRO PRODUCTS PRIVATE LIMITED,1
ECO FARMERS AGROTECH PRIVATE LIMITED,1
RAJ AGRII EXPORTS PRIVATE LIMITED,1
ROYAL ORGANIC FACTORY PRIVATE LIMITED,1
CRYSTOR BUSINESS PRIVATE LIMITED,1
AISWARIYAM AGROTECH PRIVATE LIMITED,1
AADITHYA CORP FARMS PRIVATE LIMITED,1
MASS LAND DEVELOPERS AND MAINTENANCE PRIVATE LIMITED,1
MK AGRO INDIA PRIVATE LIMITED,1
PNBC AGROFARMS PRIVATE LIMITED,1
MUTHALAGU FARMS AND ESTATES PRIVATE LIMITED,1
PNBC FARM FOODS PRIVATE LIMITED,1
MICRON PACIFIC PRIVATE LIMITED,1
ICSA AGRO PRIVATE LIMITED,1
SOUTHFIELD CONSULTANTS PRIVATE LIMITED,1
ARUN NATURALS PRIVATE LIMITED,1
ISWARA GROWGREEN AGRI PRIVATE LIMITED,1
ASSEFA SEED PRODUCER COMPANY LIMITED,1
AATHAVA PLANTATION PRIVATE LIMITED,1
BEE3 IMPORTS AND EXPORTS PRIVATE LIMITED,1
PNBC AGRITECH PRIVATE LIMITED,1
PNBC HORTICULTURE PRIVATE LIMITED,1
SARAVANA AGRO INDUSTRIES PRIVATE LIMITED,1
INDIAN VILLAGE HERBS PRIVATE LIMITED,1
ASSEFA MILK PRODUCER COMPANY LIMITED,1
CHOZHAMANDALA ORGANIC FARMER'S PRODUCER COMPANY LIMITED,1
ASSEFA LIVESTOCK PRODUCER COMPANY LIMITED,1
BIOGREEN FERTILIZERS INDIA PRIVATE LIMITED,1
KODAIKANAL FRESH VEGETABLE PRODUCER COMPANY LIMITED,1
RAJ AGRII RETAIL PRIVATE LIMITED,1
RAJ GOAT FARMS PRIVATE LIMITED,1
CHETTINADU AGROTECH PRIVATE LIMITED,1
GREENWEALTH FARMS PRIVATE LIMITED,1
REGAL CROWN TRADING PRIVATE LIMITED,1
JAYEVIJAY AGRO FARMS PRIVATE LIMITED,1
CHANDRASEKARA AGRO FARMS PRIVATE LIMITED,1
PRABHU FARMS PRIVATE LIMITED,1
PLENARY AGRO INDIA LIMITED,1
JSRM DAIRIES LIMITED,1
MAKKAL JAI BHARATH BIO - TECH INDIA LIMITED,1
REDLOTUS AGRO FARM INDIA LIMITED,1
MAXGROW AGRO & ASSET PROMOTERS LIMITED,1
SUVASAM RURAL WEALTH PROMOTORS INDIA LIMITED,1
HIMAALAYAA AGRO ASSET PROMOTERS LIMITED,1
JJT VOICE OF THUNDER AGRO PRIVATE LIMITED,1
THATHIENGARPETTAI PRECISION FARM PRODUCER COMPANY LIMITED,1
BRITISH AGRO PRODUCTS (INDIA) PRIVATE LIMITED,1
CAUVERY FARMERS PRODUCER COMPANY LIMITED,1
JEMS NATURAL RESOURCES PRIVATE LIMITED,1
DATES INDIA AGRO VENTURES PRIVATE LIMITED,1
FARM TO CONSUMER PRIVATE LIMITED,1
INNOVATIVE AGRO VENTURES (INDIA) PRIVATE  LIMITED,1
NAMAKKAL AGRO PRODUCTS AND FARMS PRIVATE  LIMITED,1
KAKANALLUR SEEVARAM BABYAMMAL AGRO PRIVATE LIMITED,1
ARUVADAI ORGANIC PRODUCE PRIVATE LIMITED,1
PANKAJAM FARMS PRIVATE LIMITED,1
TAMILNADU RAINFED FARMERS PRODUCER COMPANY LIMITED,1
ALAGAR BIO TECH PRODUCT PRIVATE LIMITED,1
SUPADHAM AGRO FOODS & ENTERPRISES PRIVATE LIMITED,1
HAMEEDHA FARMS PRIVATE LIMITED,1
ABHINAV FARM LANDS PRIVATE LIMITED,1
MJ AGROTECH PRIVATE LIMITED,1
TROPICAL BIOSCIENCES PRIVATE LIMITED,1
AMIRTHAA AGRO & GRANITES PRIVATE LIMITED,1
ULTIMA AGRO SOLUTIONS PRIVATE LIMITED,1
GREEN ORGANIC VRIKSHA PRIVATE LIMITED,1
IMMINENT AGRI FARMS PRIVATE LIMITED,1
AISHWARYAM FARMERS PRODUCER COMPANY LIMITED,1
KANISH AGRO INDUSTRIES INDIA PRIVATE LIMITED,1
SOLLERS RANCHER PRIVATE LIMITED,1
PUDUKKOTTAI ORGANIC FARMERS PRODUCER COMPANY LIMITED,1
APBN AGRO PRIVATE LIMITED,1
CUMBUMVALLEY PLANTERS PRIVATE LIMITED,1
WEFSA FARMERS PRODUCER COMPANY LIMITED,1
CYPRIOT EXISTENCE FARM PRIVATE LIMITED,1
GINGEE FARMERS PRODUCER COMPANY LIMITED,1
M.G.NATURAL FARM PRIVATE LIMITED,1
JAWADHU FARMERS PRODUCER COMPANY LIMITED,1
HADI AGRO PRODUCTS AND INDUSTRIES LIMITED,1
MANGROWTH FARM PLOW UP PRIVATE LIMITED,1
THIRUMUTHUKUNDRAM FARMERS PRODUCER COMPANY LIMITED,1
NALLAVUR FARMER PRODUCER COMPANY LIMITED,1
SPHINAX AGROTECH PRIVATE LIMITED,1
SARANGAM GREENS PRIVATE LIMITED,1
SHAKTHI FARMERS PRODUCER COMPANY LIMITED,1
KOZHUNTHUMALAI DAIRY AND AGRO PRIVATE LIMITED,1
PANRUTI FARMERS PRODUCER COMPANY LIMITED,1
SAI HAPPY FARMS PRIVATE LIMITED,1
AGK FARM PRODUCTS PRIVATE LIMITED,1
TRICHY FARMERS PRODUCER COMPANY LIMITED,1
IMPRINT CONCEPTS PRIVATE LIMITED,1
P.K. AGRO FARMS PRIVATE LIMITED,1
ANASUYA AGRO PRIVATE LIMITED,1
R IMART TRADING PRIVATE LIMITED,1
ENRICH IMPEX PRIVATE LIMITED,1
ELUPUR PROJECTS PRIVATE LIMITED,1
AAVIGNAA AGRO PRIVATE LIMITED,1
THANJAVUR PADDY AND RICE MILLERS CONSORTIUM PRIVATE LIMITED,1
TAMILNADU AGRO VENTURES PRIVATE LIMITED,1
EARTH REAL ESTATE PRIVATE LIMITED,1
PADMAJA FARMS PRIVATE LIMITED,1
PETUNIA CONSTRUCTIONS PRIVATE LIMITED,1
BHARATHI AGRO BIO FARM PRIVATE LIMITED,1
ADESWARA FOUNDATIONS PRIVATE LIMITED,1
MUTHU SARAVANA AGRI & ALLIED FARM PRIVATE LIMITED,1
GOLDEN INDIA INTEGRATED VENTURES PRIVATE  LIMITED,1
EVERGREEN ALOE PRODUCT (INDIA) PRIVATE LIMITED,1
PULVAI AGRO FARMS PRIVATE LIMITED,1
SARAMANI LAND DEVELOPERS PRIVATE LIMITED,1
ANGALA AMMAN AGROFARMS PRIVATE LIMITED,1
AFD AGROTECH LIMITED,1
GREEN SEA AGROTECH INDIA LIMITED,1
BOOMA AGRO TECH LIMITED,1
ANNAI GREEN AGRO TECH LIMITED,1
KDM HERBALS LIMITED,1
IWAY AGRO TECH LIMITED,1
TIRUVARUR ASSET PROMOTERS INDIA LIMITED,1
HARUR AGRO FARM INDIA LIMITED,1
GREEN INDIA FARMS AND DAIRY LIMITED,1
PASUMAI INDIA AGRO TECH LIMITED,1
NEW HOPE FOOD INDUSTRIES PRIVATE LIMITED,1
SURANA SPICES PRIVATE LIMITED,1
CGS FOODS PRIVATE LIMITED,1
JEYASURIYAA FOODS PRIVATE LIMITED,1
THENAMOOTHU FOODS PRIVATE LIMITED,1
BENSON AND LINSON FOODS (INDIA) PRIVATE LIMITED,1
SIRUVANI HERBAL PRODUCTS PRIVATE LIMITED,1
DURO FOOD PRODUCTS OVERSEAS PRIVATE LIMI TED,1
S. A. A INDUSTRIES PRIVATE LIMITED,1
MILKA NUTRIMENTS PRIVATE LIMITED,1
MICRO CONTROLS INDIA PRIVATE LIMITED,1
B J ELECTRONICS PRIVATE LIMITED,1
FRONTLINE ELECTRONICS PRIVATE LIMITED,1
THANGAM ELECTRONICS PRIVATE LIMITED,1
GEM DISPLAY SYSTEMS PRIVATE LIMITED,1
DAKKSHIN ELECTRO-TECH PRIVATE LIMITED,1
CHITRA ENTERPRISES PRIVATE LIMITED,1
GES ELECTRONIC SERVICES PRIVATE LIMITED,1
TECHNO MECHTRON PRIVATE LIMITED,1
RELCO RAWMAT ELECTRONICS ASSOCIATES LIMITED,1
FEMINA PRAWN CULTURE PRIVATE LIMITED,1
